Sheet: Sheet1
A1: Slide # | B1: Mount Date | C1: Subject | D1: Slide Mount Notation | E1: Scanned
A2: 1 | B2: 1962-10-01T00:00:00.000 | D2: JG start. Old monkey house. Ground removed 4' deep for flat garden | E2: X
A3: 2 | B3: 1963-01-01T00:00:00.000 | D3: Planted Jan. '63. First Japanese maple from downtown freeway. It died and was replaced with one from Sellwood | E3: X
A4: 3 | B4: 1963-08-01T00:00:00.000 | D4: 75 yr. old maple transplanted Jan. '63. from Foothill Freeway from Korea | E4: X
A5: 4 | B5: 1963-08-01T00:00:00.000 | D5: Unter contruction wood-tractor | E5: X
A6: 5 | B6: 1963-09-01T00:00:00.000 | D6: Old commissary bldg. Roof almost gone. | E6: X
A7: 6 | B7: 1963-08-01T00:00:00.000 | D7: Old bear den. Fill on curve of road | E7: X
A8: 7 | B8: 1963-08-01T00:00:00.000 | D8: Cypress. Old bird cage. Upper pond. | E8: X
A9: 8 | B9: 1963-10-01T00:00:00.000 | D9: akebino cherry. Harry Raber | E9: X
A10: 9 | B10: 1963-10-01T00:00:00.000 | D10: Planting cherry. Harry Raber-Nels Eklof. Tree from 102nd in Park Rose. | E10: X
A11: 10 | B11: 1963-10-01T00:00:00.000 | D11: Nels Eklof-Fred Clyde-Tom Ashley (red hat)-Gerry Robertson-Harry Raber-Don cornell-John Maule planting akebino cherry. | E11: X
A12: 11 | B12: 1963-10-01T00:00:00.000 | D12: Tom Ashley, Gerry Robertson, Nels Kklof, Harry Raber planting cherry | E12: X
A13: 12 | B13: 1963-10-01T00:00:00.000 | D13: Fred Clyde Planting and pruning camellia | E13: X
A14: 13 | B14: 1963-10-01T00:00:00.000 | D14: planting maples. Flat garden. City in background. | E14: X
A15: 14 | B15: 1963-10-01T00:00:00.000 | D15: Fred Clyde, Harry Raber, John Maule on tractor | E15: X
A16: 15 | B16: 1963-10-01T00:00:00.000 | D16: Fred Clyde, Harry Raber planting maple | E16: X
A17: 16 | B17: 1963-10-01T00:00:00.000 | D17: Don Cornell, Nels Eklof acer palmatum dissectum. Maple from eastmoreland. | E17: X
A18: 17 | B18: 1963-10-01T00:00:00.000 | D18: Gerry Robertson, Harry Raber, John Maule planting maples | E18: X
A19: 18 | B19: 1963-10-01T00:00:00.000 | D19: Harry Raber (walking). Gerry Robertson | E19: X
A20: 19 | B20: 1963-10-01T00:00:00.000 | D20: Fred Clyde in back. Harry Raber at blade. Planting maple from Eastmoreland Club house. | E20: X
A21: 20 | B21: 1963-10-01T00:00:00.000 | D21: Madras, OR, US National Bank. Sigina moss, Quercus coccinea. Out looking for rock for Japanese Garden. | E21: X
A22: 21 | D22: Madras, OR, US National Bank. Fastuca Glauca, Sigina Moss | E22: X
A23: 22 | B23: 1963-10-01T00:00:00.000 | D23: Madras, OR, US National Bank., Fastuca Glauca, Quercus coccinea | E23: X
A24: 23 | B24: 1963-10-01T00:00:00.000 | D24: Columbia R. Sunset at Mult. Falls looking west down river | E24: X
A25: 24 | B25: 1963-11-01T00:00:00.000 | D25: Rudie Wilhelm. Men unloading rock. Rock in foreground Rhododendron-by truck Estacada | E25: X
A26: 25 | B26: 1963-11-01T00:00:00.000 | D26: Rudie Wilhelm. Men unloading rock. Rock on left used by pagoda lantern. | E26: X
A27: 26 | B27: 1963-11-01T00:00:00.000 | D27: Ruddy's men. Rock. | E27: X
A28: 27 | B28: 1963-11-01T00:00:00.000 | D28: Unloading rock. Rock at pagoda lantern | E28: X
A29: 28 | B29: 1963-11-01T00:00:00.000 | D29: Unloading big rock. Truck rising up | E29: X
A30: 29 | B30: 1963-11-01T00:00:00.000 | D30: truck off ground. | E30: X
A31: 30 | B31: 1963-11-01T00:00:00.000 | D31: Rudie Wilhelm truck. Hauled 3 loads rocks | E31: X
A32: 31 | B32: 1963-11-01T00:00:00.000 | D32: 7:30 am. Mt. hood on way after rock. Taken near Sandy, OR | E32: X
A33: 32 | B33: 1963-11-01T00:00:00.000 | D33: Fred Norris, Jerry Robertson. Loading rock near Warm Springs Res. Bear Springs Forest | E33: X
A34: 33 | B34: 1963-11-01T00:00:00.000 | D34: George Zimmerman, Fred Norris, Jerry Roberston. Rocks from Bear Springs Forrest area-eastern Oregon | E34: X
A35: 34 | B35: 1963-11-01T00:00:00.000 | D35: Rock quarry where bridge rock came from-also island rock for Flat Garden. 2 loads of rock-Parks | E35: X
A36: 35 | B36: 1963-11-01T00:00:00.000 | D36: Dr. Tono placing the stone bridge rock. Mike Roskopf-left back, Jerry Robertson, Fred Clyde, Dr. Tono | E36: X
A37: 36 | D37: P.T. Tono, ALLYON STAL , Mike Roskopf | E37: X
A38: 37 | B38: 1963-11-01T00:00:00.000 | D38: Dr. Tono, Jerry Robertson, Mike Roskopf, Fred Clyde placing bridge rock. | E38: X
A39: 38 | B39: 1963-11-01T00:00:00.000 | D39: Placing rock at bridge-crane | E39: X
A40: 39 | B40: 1963-11-01T00:00:00.000 | C40: construction of spirit bridge. | D40: View across (flat) garden. Working on bridge | E40: X
A41: 40 | B41: 1963-11-01T00:00:00.000 | D41: Moving acer palmatum at nursery. Mike Colatorti, Wilbur Sprague, Nels Eklof | E41: X
A42: 41 | B42: 1963-11-01T00:00:00.000 | D42: Mowing acer back of rest room. At falls public works crane. Tom & Jerry | E42: X
A43: 42 | B43: 1963-11-01T00:00:00.000 | D43: Acer in air | E43: X
A44: 43 | B44: 1963-11-01T00:00:00.000 | D44: Acer high in air. Harry Raber, Mike Colatorti, Nels Eklof | E44: X
A45: 44 | B45: 1963-11-01T00:00:00.000 | D45: Acer finally planted. Tom Ashley, Mike J., Colatorti, Harry Raber, Nels Elkof, Jerry Robertson. | E45: X
A46: 45 | B46: 1963-11-01T00:00:00.000 | D46: Acer start of falls, rocks selected back of rest room | E46: X
A47: 46 | B47: 1963-11-01T00:00:00.000 | D47: Acer planted by tea house. Harry, Nels, Mike, Jerry | E47: X
A48: 47 | B48: 1963-11-01T00:00:00.000 | D48: Dr. Tono, Ed Erickson, Fred Clyde, Mike Roskopf, Placing island rocks | E48: X
A49: 48 | B49: 1963-11-01T00:00:00.000 | D49: Dr. Tono & his bridge | E49: X
A50: 49 | B50: 1963-11-01T00:00:00.000 | D50: Stone Bridge in Sea of Mud | E50: X
A51: 50 | B51: 1963-11-01T00:00:00.000 | D51: Ed Erickson left, Dr. Tono center, Mrs. Leith Abbott | E51: X
A52: 51 | B52: 1963-11-01T00:00:00.000 | D52: Looking Towards bridge-south half of Flat Garden | E52: X
A53: 52 | B53: 1963-11-01T00:00:00.000 | D53: Pinus contorta in Tom Young garden, 3114 NW Verde Vista Terrace | E53: X
A54: 53 | B54: 1963-11-01T00:00:00.000 | D54: Stone Basin, Tom Young garden, 3114 NW Verde Vista Terrace | E54: X
A55: 54 | B55: 1963-11-01T00:00:00.000 | D55: J Lantern, Tom Young garden, 3114 NW Verde Vista Terrace | E55: X
A56: 55 | B56: 1963-11-01T00:00:00.000 | D56: Tom Young garden, 3114 NW Verde Vista Terrace | E56: X
A57: 56 | B57: 1963-11-01T00:00:00.000 | D57: Looking west, Flat Garden | E57: X
A58: 57 | B58: 1963-11-01T00:00:00.000 | D58: Looking west, close of day | E58: X
A59: 58 | B59: 1963-11-01T00:00:00.000 | D59: Looking south across bridge | E59: X
A60: 59 | B60: 1963-11-01T00:00:00.000 | D60: Stone bridge left Front stones. Mud | E60: X
A61: 60 | B61: 1964-02-01T00:00:00.000 | D61: Maple from Stone Bridge. Yew trees from | E61: X
A62: 61 | B62: 1964-02-01T00:00:00.000 | D62: Ted Carnese, Nels Eklof-bamboo Foothills Freeway | E62: X
A63: 62 | B63: 1964-02-01T00:00:00.000 | D63: Ted Carnese, Nels Eklof-bamboo Foothills Freeway | E63: X
A64: 63 | B64: 1964-02-01T00:00:00.000 | D64: Bamboo backyard, Frank Hemmenway. Ted Carnese, Nels Eklof | E64: X
A65: 64 | B65: 1964-02-01T00:00:00.000 | D65: Planting bamboo-tea house. Ted Carnese, Frank Hemmingway, Nels Eklof | E65: X
A66: 65 | B66: 1964-02-01T00:00:00.000 | D66: J. weeping cherry. Mike Colatorti, Wilbur Sprague | E66: X
A67: 66 | B67: 1964-02-01T00:00:00.000 | D67: Weeping cherry-digging. Wilbur Sprague, Mike Colatorti | E67: X
A68: 67 | B68: 1964-02-01T00:00:00.000 | D68: Cherry. Loading tree | E68: X
A69: 68 | B69: 1964-02-01T00:00:00.000 | D69: Unloading cherry tree. Mike Colatorti, Don Cornell, Tom Ashley, Joe Grab. | E69: X
A70: 69 | C70: cherry tree in ground | E70: X
A71: 70 | C71: female Foo Dog in crate | D71: Dog | E71: X
A72: 71 | B72: 1964-02-01T00:00:00.000 | D72: Stone bridge | E72: X
A73: 72 | B73: 1964-02-01T00:00:00.000 | D73: Looking across Flat Garden. Large maple out of picture. Weeping cherry finished planting. | E73: X
A74: 73 | B74: 1964-02-01T00:00:00.000 | D74: Mt. Hood-clear Feb. day. From Flat garden. Rose Garden below. | E74: X
A75: 74 | B75: 1964-02-01T00:00:00.000 | D75: Maple. Tualatin, OR see 335 too | E75: X
A76: 75 | B76: 1964-02-01T00:00:00.000 | D76: Moving Avery's J Maple. Fred Clyde in hole, Jerry Robertson, Tom Ashley | E76: X
A77: 76 | B77: 1964-02-01T00:00:00.000 | D77: Avery's J Maple. Jerry Robertson directing Fred Clyde holding on to tree. | E77: X
A78: 77 | B78: 1964-02-01T00:00:00.000 | D78: Tipping over maple to remove rod thru ball with plate on bottom. North of restroom. Clockwise: Mike Roskopf, Wilbur Sprague, Jerry Robertson, Tom Ashley, Fred Clyde. | E78: X
A79: 78 | B79: 1964-04-01T00:00:00.000 | D79: Wilbur Sprague, Fred Clyde digging magnolia. Donated by Mrs. Lawyer, SW Sunset Blvd. | E79: X
A80: 79 | B80: 1964-04-01T00:00:00.000 | D80: Pulling magnolia down street. Mrs. Lawyer, 3008 SW Sunset Blvd. | E80: X
A81: 80 | B81: 1964-03-01T00:00:00.000 | D81: Rock hunting up Columbia milepost 51. Phil Englehart-Leith Abbott. Shell Rock Mtn. | E81: X
A82: 81 | B82: 1964-03-01T00:00:00.000 | D82: Rock hunting up Columbia milepost 51. Phil Englehart, Leith Abbott | E82: X
A83: 82 | B83: 1964-03-01T00:00:00.000 | D83: Phil Englehart looking at rock. Mosier, Columbia River | E83: X
A84: 83 | B84: 1964-03-01T00:00:00.000 | D84: William Robinson sitting on pine-Rowena Point, Columbia River Hwy | E84: X
A85: 84 | B85: 1964-03-01T00:00:00.000 | D85: Rock hunting-Rowena. Phil Englehart-Leith Abbott. Columbia River Hwy | E85: X
A86: 85 | B86: 1964-03-01T00:00:00.000 | D86: Rock hunting-Rowena Point. Phil Englehart-Leith Abbott. | E86: X
A87: 86 | B87: 1964-04-01T00:00:00.000 | D87: Clarence Potter, Condon, OR. Rocks on ridge, Lonerock, OR. Above Boone Canyon | E87: X
A88: 87 | B88: 1964-04-01T00:00:00.000 | D88: Bill Robinson, brother-in-law Clarence Potter looking at stepping stones on ridge. Lone Rock, OR. Bill's grandfather's homestead. | E88: X
A89: 88 | B89: 1964-04-01T00:00:00.000 | D89: Clarence Potter & Bill Robinson looking at stepping stones. Lone Rock, OR | E89: X
A90: 89 | B90: 1964-05-01T00:00:00.000 | D90: Fred Clyde and Wilbur Sprague grading garden. Taken from restroom looking NE | E90: X
A91: 90 | B91: 1964-05-01T00:00:00.000 | D91: Mrs. Avery's maple, Tualatin, OR. North of restroom | E91: X
A92: 91 | B92: 1964-06-01T00:00:00.000 | D92: Viewpoint near Condon, OR, above John Day River. Looking for stepping stones. Mt. Hood 200 miles away. | E92: X
A93: 92 | B93: 1964-06-01T00:00:00.000 | D93: Stepping stones-dime on rock. Rattle snake 8 rattles. On ridge at Lone Rock | E93: X
A94: 93 | B94: 1964-06-01T00:00:00.000 | D94: Flat rocks. Above Boone canyon at Lone Rock, OR. Sheepherder piled up rock. | E94: X
A95: 94 | B95: 1964-06-01T00:00:00.000 | D95: Rocks piled up-Lone Rock looking towards Pendleton. Blue Mtns. In distance. Grandpa's Robinson homestead. | E95: X
A96: 95 | B96: 1964-06-01T00:00:00.000 | D96: Lone Rock, OR. Flat stepping stones back of Flat Top Hill in picture. | E96: X
A97: 96 | B97: 1964-06-01T00:00:00.000 | D97: Lone Rock close view | E97: X
A98: 97 | B98: 1964-06-01T00:00:00.000 | D98: On way back home from Condon. Taken at Maupin just at edge of forest. | E98: X
A99: 98 | B99: 1964-06-01T00:00:00.000 | D99: Near Maupin | E99: X
A100: 99 | B100: 1963-09-01T00:00:00.000 | D100: Trillium Lake, Mt. Hood. Joanne & Don & us. | E100: X
A101: 100 | B101: 1963-08-01T00:00:00.000 | D101: Haystack Rock, Cannon Beach. | E101: X
A102: =R[-1]C+1 -> 101 | C102: Spirit bridge | E102: X
A103: =R[-1]C+1 -> 102 | E103: X
A104: =R[-1]C+1 -> 103 | C104: Spirit bridge across empty flat garden | E104: X
A105: =R[-1]C+1 -> 104 | E105: X
A106: =R[-1]C+1 -> 105 | B106: 1964-10-01T00:00:00.000 | D106: Hillside near entrance. White azeala hill. | E106: X
A107: =R[-1]C+1 -> 106 | C107: Pre-Heavenly Falls hillside | E107: X
A108: =R[-1]C+1 -> 107 | C108: Dragline preparing to dig stroll garden | D108: (no notes included) | E108: X
A109: =R[-1]C+1 -> 108 | C109: Stroll Garden excavation | D109: (no notes included) | E109: X
A110: =R[-1]C+1 -> 109 | B110: 1964-10-01T00:00:00.000 | C110: Stroll Garden excavation | E110: X
A111: =R[-1]C+1 -> 110 | C111: Stroll Garden excavation | E111: X
A112: =R[-1]C+1 -> 111 | C112: Drainage below stroll garden stream? | E112: X
A113: =R[-1]C+1 -> 112 | C113: Drainage below stroll garden stream? | E113: X
A114: =R[-1]C+1 -> 113 | C114: concrete mixer | E114: X
A115: =R[-1]C+1 -> 114 | B115: 1964-10-01T00:00:00.000 | C115: stroll garden concrete | E115: X
A116: =R[-1]C+1 -> 115 | C116: stroll garden concrete | E116: X
A117: =R[-1]C+1 -> 116 | B117: 1964-10-01T00:00:00.000 | C117: stroll garden concrete | E117: X
A118: =R[-1]C+1 -> 117 | C118: stroll garden concrete | E118: X
A119: =R[-1]C+1 -> 118 | C119: Mt. Hood | E119: X
A120: =R[-1]C+1 -> 119 | C120: water falls (on Hood?) | E120: X
A121: =R[-1]C+1 -> 120 | E121: X
A122: =R[-1]C+1 -> 121
A123: =R[-1]C+1 -> 122 | D123: Cut stone from this wall used in base of Zen Garden | E123: X
A124: =R[-1]C+1 -> 123
A125: =R[-1]C+1 -> 124 | D125: Hugh Shogren, City Gardener
A126: =R[-1]C+1 -> 125 | D126: Spokane Buddhist Church, Japanese Garden 9-15-63
A127: =R[-1]C+1 -> 126 | D127: Buddhist Church, Spokane, WA, 600 S. Cowley, setting #4 9-15-63, almost rain
A128: =R[-1]C+1 -> 127 | D128: Highland Methodist Church Japanese Garden, S. Garfield at Hartson, Spokane, WA, #4 set rain, 9-15-63
A129: =R[-1]C+1 -> 128 | D129: Highland Methodist, Spokane 9-15-63
A130: =R[-1]C+1 -> 129 | D130: Highland Methodist Church, Spokane, WA. Pines back of church 9-15-63
A131: =R[-1]C+1 -> 130 | D131: Highland Methodist, Spokane 9-15-63
A132: =R[-1]C+1 -> 131 | D132: Highland Methodist Church Japanese Garden, S. Garfield at Hartson, Spokane, WA, 9-15-63
A133: =R[-1]C+1 -> 132 | B133: 1963-10-01T00:00:00.000 | D133: Highland Methodist Church Japanese Garden, Spokane, 9-15-63
A134: =R[-1]C+1 -> 133 | D134: Highland Methodist Church Japanese Garden, Spokane, 9-15-63 | E134: X
A135: =R[-1]C+1 -> 134 | E135: X
A136: =R[-1]C+1 -> 135 | E136: X
A137: =R[-1]C+1 -> 136 | E137: X
A138: =R[-1]C+1 -> 137 | D138: MacKinzie River | E138: X
A139: =R[-1]C+1 -> 138 | B139: 1964-10-01T00:00:00.000 | C139: MacKinzie River | E139: X
A140: =R[-1]C+1 -> 139 | B140: 1964-10-01T00:00:00.000 | E140: X
A141: =R[-1]C+1 -> 140 | B141: 1964-10-01T00:00:00.000 | E141: X
A142: =R[-1]C+1 -> 141 | B142: 1964-12-01T00:00:00.000 | C142: Tono at Spirit Bridge | E142: X
A143: =R[-1]C+1 -> 142 | C143: Wet Heron Lantern in flat garden | E143: X
A144: =R[-1]C+1 -> 143 | C144: Spirit Bridge | E144: X
A145: =R[-1]C+1 -> 144 | C145: Tono at Spirit Bridge | E145: X
A146: =R[-1]C+1 -> 145 | C146: Wet Heron Lantern in flat garden | E146: X
A147: =R[-1]C+1 -> 146 | B147: 1964-12-01T00:00:00.000 | E147: X
A148: =R[-1]C+1 -> 147 | B148: 1964-12-01T00:00:00.000 | C148: Pagoda w/yew hedge | E148: X
A149: =R[-1]C+1 -> 148 | E149: X
A150: =R[-1]C+1 -> 149 | B150: 1964-12-01T00:00:00.000 | C150: Tono at Wet Heron Lantern | E150: X
A151: =R[-1]C+1 -> 150 | E151: X
A152: =R[-1]C+1 -> 151 | E152: X
A153: =R[-1]C+1 -> 152 | D153: Prof. Tono, Ron Snell-son in law of Bill Robinson | E153: X
A154: =R[-1]C+1 -> 153 | D154: Eastern Oregon | E154: X
A155: =R[-1]C+1 -> 154 | E155: X
A156: =R[-1]C+1 -> 155 | B156: 1964-12-01T00:00:00.000 | C156: Loading stone in the Gorge | E156: X
A157: =R[-1]C+1 -> 156 | C157: Tono supervising unloading stone | E157: X
A158: =R[-1]C+1 -> 157 | C158: Tono | E158: X
A159: =R[-1]C+1 -> 158 | E159: X
A160: =R[-1]C+1 -> 159 | C160: Setting stone around the pond | E160: X
A161: =R[-1]C+1 -> 160 | B161: 1964-12-01T00:00:00.000 | E161: X
A162: =R[-1]C+1 -> 161
A163: =R[-1]C+1 -> 162
A164: =R[-1]C+1 -> 163
A165: =R[-1]C+1 -> 164
A166: =R[-1]C+1 -> 165
A167: =R[-1]C+1 -> 166
A168: =R[-1]C+1 -> 167
A169: =R[-1]C+1 -> 168
A170: =R[-1]C+1 -> 169
A171: =R[-1]C+1 -> 170
A172: =R[-1]C+1 -> 171
A173: =R[-1]C+1 -> 172
A174: =R[-1]C+1 -> 173
A175: =R[-1]C+1 -> 174
A176: =R[-1]C+1 -> 175
A177: =R[-1]C+1 -> 176
A178: =R[-1]C+1 -> 177
A179: =R[-1]C+1 -> 178
A180: =R[-1]C+1 -> 179
A181: =R[-1]C+1 -> 180
A182: =R[-1]C+1 -> 181
A183: =R[-1]C+1 -> 182
A184: =R[-1]C+1 -> 183
A185: =R[-1]C+1 -> 184
A186: =R[-1]C+1 -> 185
A187: =R[-1]C+1 -> 186
A188: =R[-1]C+1 -> 187
A189: =R[-1]C+1 -> 188
A190: =R[-1]C+1 -> 189
A191: =R[-1]C+1 -> 190
A192: =R[-1]C+1 -> 191
A193: =R[-1]C+1 -> 192
A194: =R[-1]C+1 -> 193
A195: =R[-1]C+1 -> 194
A196: =R[-1]C+1 -> 195
A197: =R[-1]C+1 -> 196
A198: =R[-1]C+1 -> 197
A199: =R[-1]C+1 -> 198
A200: =R[-1]C+1 -> 199
A201: =R[-1]C+1 -> 200